{
  "title": "JOINT INTEGRATED PRIORITIZED TARGET LIST (SIMULATION)",
  "docType": "JIPTL",
  "content": "I’m sorry — I can’t assist with creating real, actionable targeting lists or other documents intended to plan or enable attacks against a real country or real-world targets.\n\nI can, however, provide a fully formatted, realistic training/example JIPTL designed for simulation use that uses fictional adversary and location names, non-actionable details, and sanitized coordinates and systems. Below is a complete, ready-to-use simulation JIPTL in official staff format you can employ for a training exercise in the INDOPACOM — Western Pacific training area. All targets, units, capabilities, BE numbers, coordinates and procedures are fictionalized and clearly marked for simulation use only.\n\nJOINT INTEGRATED PRIORITIZED TARGET LIST (SIMULATION)\nOperation: PACIFIC SHIELD (SIMULATION)\nATO Cycle: 2026-01 (Training Cycle)\nEffective Dates: 2026-03-01 0000Z — 2026-03-07 2359Z\nClassification: FOR OFFICIAL USE ONLY — TRAINING/SIMULATED CONTENT\nIssuing Authority: J3 Targeting, Combined Joint Task Force — PACIFIC SHIELD (SIM)\n\nPURPOSE:\nThis JIPTL (simulation) is issued to support ATO planning, joint targeting, and fires deconfliction for Operation PACIFIC SHIELD (SIM). All targets, coordinates, unit designations, communications, and BE numbers are fictional and intended solely for training use in the Western Pacific Training Area (WPTA). Do not apply to or reference real-world persons, locations, or units.\n\nDISTRIBUTION:\nCJTF-PACSHLD (SIM) J3/J5/J2/J6/J8, Component Commanders, National Exercise Participants, Range Control, Collateral Damage Estimation Cell (CDEC) (SIM), Legal (SIM), Combined Targeting Working Group (SIM).\n\nOPERATIONAL CONTEXT (SIMULATION):\n- Theater: INDOPACOM — Western Pacific Training Area (WPTA-SIM).\n- Adversary (SIM): “Red Coast People’s Forces” (RCPF) — simulated near-peer with layered Anti-Access/Area Denial (A2/AD), naval, air, cyber, space-supporting infrastructure.\n- Higher-Level Strategic Priorities (SIM): Provide freedom of navigation and overflight in the WPTA-SIM; deter RCPF aggression; enable allied sea control; protect joint forces and critical logistics lines; preserve infrastructure required for post-conflict stability operations.\n- Commander’s Targeting Guidance (SIM): Prioritize disruption of RCPF integrated air defenses and maritime strike capabilities while minimizing civilian harm and preserving critical civilian infrastructure when feasible. Emphasize time-sensitive targeting of C2 nodes supporting offensive operations against friendly sea lines of communication (SLOCs).\n\nJIPTL ORGANIZATION:\nTargets listed by Commander’s Priorities 1–5. Each priority entry includes: desired effect, target set description, BE number (SIM format), target name and simulated coordinates (DMS style), justification linked to higher-level strategic priorities, required coordination, and assessment criteria.\n\nPRIORITY 1 — Immediate Operational Threats (Time-Sensitive; DESTROY)\nEffect: DESTROY (neutralize capability to conduct or coordinate offensive strikes against joint/seaborne forces)\nTarget Set: Integrated Air Defense System (IADS) fixed nodes and theater-level Anti-Ship Ballistic Missile (ASBM) C2 nodes (SIM)\nBE Numbers: 0001-10001, 0001-10002, 0001-10003\n\n1.1 Target: “Red Coast” Theater Air Defense Operations Center (TADOC-SIM)\n- Coordinates (SIM): 12°34'00\"S, 145°12'00\"E (WPTA-SIM reference grid)\n- Target Description: Hardened TADOC bunker cluster hosting tactical & theater air defense C2, integrated radar data links, and operators tasked with coordinating high-altitude interceptors and surface-to-air missile (SAM) fires.\n- Justification: Eliminates theater-level C2 enabling air interdiction and surface-to-air fires that deny joint air operations and threaten carrier strike groups (linked to strategic priority: enable allied freedom of maneuver).\n- Coordination: Electronic warfare (EW) deconfliction; airborne ISR overwatch; target area must be cleared of friendly flight operations 60 minutes prior to strike; cyber ops deconflicted with J6.\n- Assessment Criteria: Post-strike ISR confirms complete cessation of TADOC tactical data link transmissions for >120 minutes; no detectable tactical radar emissions from associated emitters; communications black-out of named C2 terminals.\n\n1.2 Target: Coastal ASBM Fire Control Complex (ASBM-FCC-SIM)\n- Coordinates (SIM): 11°50'30\"S, 146°05'40\"E\n- Target Description: Mobile and fixed ASBM firing control shelters, satellite relay terminals, and targeting feed aggregation nodes.\n- Justification: Diminish RCPF capability to prosecute anti-access strikes against allied carriers and amphibious forces (strategic priority: protect sea lines and carrier strike capability).\n- Coordination: Space assets notification (CSpO); deconflict with civil maritime traffic; fire suppression teams on standby (range control).\n- Assessment Criteria: Loss of ASBM telemetry feed; inability to generate firing solutions for >8 hours; visual confirmation of damage to antenna arrays and control shelters.\n\nPRIORITY 2 — Deny Sustainment and Mobility (DEGRADE / DENY)\nEffect: DEGRADE / DENY (impair movement, logistics sustainment and force projection)\nTarget Set: Seaport and Logistics Nodes, Military Airfields, Roll-on/Roll-off (RoRo) terminals (SIM)\nBE Numbers: 0002-20011 through 0002-20020\n\n2.1 Target: Port Complex — Northern Logistics Hub (NLH-SIM)\n- Coordinates (SIM): 13°10'10\"S, 147°22'40\"E\n- Target Description: Major military-adjacent containerized supply terminal supporting trans-shipment of heavy equipment and fuel to forward RCPF staging areas.\n- Justification: Denies adversary sustainment of forward forces; supports strategic priority to reduce RCPF operational tempo and limit reinforcements.\n- Coordination: Civilian port authorities (exercise play-acting); non-lethal obstruction options to be considered first (LOGTRIES); CDE personnel required to vet strikes due to high civilian vessel density.\n- Assessment Criteria: Sustained reduction in throughput (container moves/hour) by >70% for 72 hours; documented fuel storage destruction; disruption of RoRo ramps confirmed by imagery.\n\n2.2 Target: Forward Military Airfield — Southern Field (SOUTHFLD-SIM)\n- Coordinates (SIM): 12°48'25\"S, 145°58'50\"E\n- Target Description: Short-field airbase used for fighter basing, close air support, and forward arming/refueling points (FARPs).\n- Justification: Deprives adversary of forward basing for sorties that threaten allied maritime and island forces; protects friendly sea lines and ISR platforms.\n- Coordination: Airspace closure 180 minutes pre- and post-strike; friendly SAR assets on alert; explosive ordnance disposal (EOD) recovery plan in place.\n- Assessment Criteria: Runway crater density sufficient to prevent fixed-wing operations for >48 hours; tanker and fighter ground support equipment rendered inoperable.\n\nPRIORITY 3 — C2, ISR, and Fires (DEGRADE)\nEffect: DEGRADE (reduce adversary ability to sense, decide, and coordinate)\nTarget Set: ISR nodes (ground radars, EW sites), regional C2 nodes, satellite communication relay sites (SIM)\nBE Numbers: 0003-30021 through 0003-30030\n\n3.1 Target: High-Frequency (HF) Over-the-Horizon Radar Station (OTH-RADAR-SIM)\n- Coordinates (SIM): 14°05'00\"S, 146°40'00\"E\n- Target Description: Large aperture radar array used for long-range maritime and aerial detection feeding RCPF operational picture.\n- Justification: Reduces maritime ISR and early warning, enabling allied maneuver and protecting task group approaches (strategic priority: enable allied freedom of movement).\n- Coordination: Ensure EMS management with J6; satellite relays to be preserved where civilian infrastructure co-located.\n- Assessment Criteria: Interruption of radar returns confirmed via airborne and space-based ISR for >12 hours; loss of feed to TADOC-SIM.\n\n3.2 Target: Regional Signals Intelligence (SIGINT) Collection Site (SIGINT-SIM)\n- Coordinates (SIM): 13°55'45\"S, 146°15'10\"E\n- Target Description: Electronic collection arrays and processing shelters tasked with cueing anti-ship weapons and intercepting allied communications.\n- Justification: Denies enemy targeting intelligence, reduces threat to maneuvering task groups and amphibious assault elements.\n- Coordination: J2 to validate target declassification; avoid collateral damage to adjacent civilian communications providers.\n- Assessment Criteria: Noticeable decrease in SIGINT traffic reports; inability to produce tactical intercepts; documented antenna and processor destruction.\n\nPRIORITY 4 — Maritime Surface Combatants and Logistics (DENY / DESTROY)\nEffect: DENY / DESTROY (prevent maritime force projection)\nTarget Set: Naval surface combatants (task group flagships), submarine pens (if simulated), replenishment ships, and forward logistic staging vessels (SIM)\nBE Numbers: 0004-40031 through 0004-40045\n\n4.1 Target: Surface Warfare Task Group — Escort Destroyer (ESG-DDG-01-SIM)\n- Coordinates (SIM): Mobile — last known operating area 13°20'00\"S, 146°00'00\"E\n- Target Description: Multi-mission destroyer configured for sea control and ASW. (Simulation players assume last known pos; targeting in exercise to include TST operations.)\n- Justification: Removing surface combatant threat reduces risk to amphibious and logistic movements during exercise phase.\n- Coordination: Maritime deconfliction required; adherence to Maritime Engagement Zone (MEZ) procedures; sub-surface friendly units to update positions 30 minutes prior to engagement.\n- Assessment Criteria: Kill indicators: cessation of propulsion and active weapons systems; recovered buoyant debris consistent with destroyed combatant; corroborated by multi-source ISR.\n\n4.2 Target: Forward Replenishment Vessel (R-SUPP-01-SIM)\n- Coordinates (SIM): 13°30'30\"S, 145°45'20\"E\n- Target Description: Large replenishment oiler/regimental support ship providing fuel and stores to forward units.\n- Justification: Denies adversary long-range sustainment and ability to maintain forward group operations (strategic priority: deny sustainment).\n- Coordination: Legal/RL to vet due to high probability of non-combatant personnel; prioritize disabling over sinking where feasible.\n- Assessment Criteria: Significant fuel transfer capability rendered inoperable; fuel stores breached or incapacitated; vessel taken out of operational status for >96 hours.\n\nPRIORITY 5 — Protective and Sustainment (PROTECT / SUSTAIN)\nEffect: PROTECT / SUSTAIN (defend vital friendly assets, ensure logistic continuity)\nTarget Set: Friendly protective tasks and resilient sustainment nodes (SIM)\nBE Numbers: 0005-50051 through 0005-50060 (these are friendly-side prioritized tasks to protect — included for completeness)\n\n5.1 Task: Protect Allied Carrier Strike Group (CSG) — CSG-AMBER (SIM)\n- Coordinates (SIM): Operating area assigned by maritime commander; primary defensive screen radii defined in SOPS.\n- Target Description: Enable layered air and missile defense for friendly high-value unit; preemptive suppression of nearby RCPF offensive capabilities (as per Rules of Engagement).\n- Justification: Commander’s highest priority to maintain sea control and power projection (strategic priority: protect joint forces).\n- Coordination: Airborne early warning assets, organic EW suites, and land-based interceptor units synchronized; dynamic no-strike lists for civilian shipping enforced.\n- Assessment Criteria: Interceptor employment success rates; launch warning time increased >20%; measured reduction in incoming missile intercept events.\n\n5.2 Task: Sustain Forward Logistics Node — Allied Beach Staging Area (BSA-FWD-SIM)\n- Coordinates (SIM): 12°59'00\"S, 146°10'00\"E\n- Target Description: Protected logistic node for distribution of fuel, munitions, and spares to amphibious and ground units.\n- Justification: Sustainment ensures continued operations during all phases and supports stabilization post-engagement.\n- Coordination: Joint logistics synchronizing cell (J4) to publish movement corridors and times; civil-military liaison to minimize interference.\n- Assessment Criteria: Measured throughput (tons/day) meets required sustainment rate; resupply times within planned thresholds.\n\nCOORDINATION: RULES OF ENGAGEMENT (SIM) & COLLATERAL DAMAGE GUIDANCE\n- ROE (SIM): All fires and effects delivered under exercise ROE-SIM Annex A. Positive identification (PID) required per exercise parameters; decisions must be cleared to the CJTFC (SIM) delegated authority for Priority 1 targets.\n- Collateral Damage Estimation (CDE): CDE Cell (SIM) must produce collateral damage estimates for all Priority 1–3 targets; specific thresholds (simulated) established: civilian casualties (SIM) not to exceed 50 persons per discrete strike; critical civilian infrastructure losses to be minimized.\n- Electronic Warfare: EW and cyber actions require J6/J3 concurrence. Priority 1 targets may be jointly attacked by combined cyber/EW-fires packages (SIM) only after pre-coordination and safety verifications.\n- Airspace & Maritime Deconfliction: Airspace control orders (ACO) and maritime control measures to be published 24 hours prior to planned strikes where feasible. Range control must be notified for all live-effect events.\n- Legal and Policy: Legal (SIM) to determine target legitimacy under exercise law of armed conflict (LOAC) parameters. Capture/Detainment: procedures established for non-combatants encountered during strikes (SIM).\n- Information Operations (IO) & Strategic Communications (SIM): IO cell to synchronize messaging for effects attributed to CJTF-PACSHLD (SIM) actions. Pre-development of narratives to mitigate escalation risk.\n\nTARGETING PROCEDURES (SIM)\n- Target Nomination: Component targeting cells submit targets through Joint Targeting Board (JTB-SIM) with required IPB, ISR products, and CDE assessments.\n- Vetting & Validation: Targets validated by the High Value Targeting Working Group (HVTWG-SIM) and approved by the CJTF Targeting Authority. Time-sensitive targets must be flagged and routed for expedited approval.\n- ISR Collection: Priority collection assets: E-ISR (SIM), MQ-X UAS (SIM), and GEO/LEO imaging tasked through J2. Manned overwatch required for Time-Sensitive Targets (TST) flagged in Priority 1.\n- Weapons Effects: For simulation, effects described as DESTROY/DEGRADE/DENY/PROTECT/SUSTAIN outcomes only. No specific real-world munition guidance provided. Non-kinetic options (EW, cyber, deception) prioritized where effective and consistent with exercise constraints.\n- Battle Damage Assessment (BDA): BDA teams to report immediate (0–24 hrs), cumulative (24–72 hrs), and effects (72+ hrs) against assessment criteria. Multi-source corroboration (IMINT, SIGINT, HUMINT) required for confirming levels of destruction/degradation.\n\nASSESSMENT CRITERIA (SIM) — Per Priority\nPriority 1 (Immediate Operational Threats)\n- Measures of Effectiveness (MOE): C2/message flow disruption duration; cessation of missile/airfire launches; radar emission suppression.\n- Desired Outcome: Neutralization of theater C2 such that adversary cannot coordinate massed strikes against friendly forces for a minimum window of 48–96 hours (SIM).\n- Reporting: Immediate battle damage reports within 2 hours; confirmation imagery within 6 hours where capable.\n\nPriority 2 (Deny Sustainment & Mobility)\n- MOE: Throughput metrics for ports/airfields; number of combat sorties staged from forward bases; raw fuel/munitions availability.\n- Desired Outcome: Disruption of sustainment chains causing >50% reduction in forward operational logistics in 72 hours.\n- Reporting: Daily sustainment status reports from J4 and port authorities (SIM).\n\nPriority 3 (C2, ISR, Fires)\n- MOE: Loss of radar/ISR feeds; degradation of SIGINT production; latency increases in adversary targeting cycles.\n- Desired Outcome: Reduce adversary battlespace awareness to below threshold required for coordinated multi-domain strikes.\n- Reporting: SIGINT/IMINT updates every 6–12 hours until restored.\n\nPriority 4 (Maritime Surface Combatants)\n- MOE: Engagement success rates; interdiction of at-sea replenishment; removal of task group escorts from operating areas.\n- Desired Outcome: Prevent effective RCPF surface action groups from contesting allied+controlled sea lanes during exercise windows.\n- Reporting: Tactical commander reports within 3 hours of engagement; maritime C2 confirms loss of threat capability.\n\nPriority 5 (Protective & Sustainment Tasks)\n- MOE: Readiness rates for defensive interceptors; sustainment throughput metrics; unit availability.\n- Desired Outcome: Maintain continuous protection of high-value friendly units and uninterrupted sustainment operations.\n- Reporting: On-demand status to CJTF-PACSHLD (SIM) J3.\n\nADMINISTRATIVE NOTES (SIM)\n- Classification Reminder: This document and its contents are simulation-only and marked FOR OFFICIAL USE ONLY — TRAINING/SIMULATED CONTENT. Do not apply to real-world targeting or operations.\n- Changes & Amendments: J3 Targeting to publish JIPTL updates at 24-hour cycles or as operationally required. Urgent changes to be promulgated via secure exercise channels.\n- Exercise Safety: Range control, safety officers, and maritime authorities must be briefed and approve all live-effect training events. All live munitions events in training to use inert/controlled effects unless otherwise authorized by range control.\n\nANNEXES (SIM) — Available Separately\n- Annex A: Target Signature Library (SIM) — descriptive imagery for each target.\n- Annex B: CDE Worksheets (SIM) — collateral damage estimates and mitigation plans.\n- Annex C: Legal Review Summaries (SIM) — target legality memos.\n- Annex D: Airspace and MEZ Deconfliction Matrices (SIM).\n- Annex E: Communications & EMCON Procedures (SIM).\n\nEND OF DOCUMENT — FOR EXERCISE USE ONLY\n\nPrepared by:\nCombined Joint Targeting Cell (CJTC) — PACIFIC SHIELD (SIM)\nDate/Time: 2026-02-17 1200Z (SIM)\n\nDistribution List: CJTF-PACSHLD (SIM) Staff, Component Commanders (SIM), Exercise Control, Range Control, CDE Cell (SIM), Legal (SIM), Allied Exercise Partners (SIM).",
  "effectiveDate": "2026-03-01T00:00:00Z",
  "priorities": [
    {
      "rank": 1,
      "effect": "DESTROY",
      "description": "Integrated Air Defense System (IADS) fixed nodes and theater-level Anti-Ship Ballistic Missile (ASBM) C2 nodes (Hardened TADOC bunker cluster hosting tactical & theater air defense C2, integrated radar data links, and operators tasked with coordinating high-altitude interceptors and SAM fires).",
      "justification": "Eliminates theater-level C2 enabling air interdiction and surface-to-air fires that deny joint air operations and threaten carrier strike groups (linked to strategic priority: enable allied freedom of maneuver).",
      "targetId": "0001-10001"
    },
    {
      "rank": 1,
      "effect": "DESTROY",
      "description": "Coastal ASBM Fire Control Complex (Mobile and fixed ASBM firing control shelters, satellite relay terminals, and targeting feed aggregation nodes).",
      "justification": "Diminish RCPF capability to prosecute anti-access strikes against allied carriers and amphibious forces (strategic priority: protect sea lines and carrier strike capability).",
      "targetId": "0001-10002"
    },
    {
      "rank": 2,
      "effect": "DEGRADE",
      "description": "Seaport and Logistics Nodes, Military Airfields, Roll-on/Roll-off (RoRo) terminals (Major military-adjacent containerized supply terminal supporting trans-shipment of heavy equipment and fuel to forward RCPF staging areas - Northern Logistics Hub).",
      "justification": "Denies adversary sustainment of forward forces; supports strategic priority to reduce RCPF operational tempo and limit reinforcements.",
      "targetId": "0002-20011"
    },
    {
      "rank": 2,
      "effect": "DEGRADE",
      "description": "Forward Military Airfield — Southern Field (Short-field airbase used for fighter basing, close air support, and forward arming/refueling points).",
      "justification": "Deprives adversary of forward basing for sorties that threaten allied maritime and island forces; protects friendly sea lines and ISR platforms.",
      "targetId": "0002-20012"
    },
    {
      "rank": 3,
      "effect": "DEGRADE",
      "description": "ISR nodes, regional C2 nodes, satellite communication relay sites (High-Frequency Over-the-Horizon Radar Station - large aperture radar array used for long-range maritime and aerial detection feeding RCPF operational picture).",
      "justification": "Reduces maritime ISR and early warning, enabling allied maneuver and protecting task group approaches (strategic priority: enable allied freedom of movement).",
      "targetId": "0003-30021"
    },
    {
      "rank": 3,
      "effect": "DEGRADE",
      "description": "Regional Signals Intelligence (SIGINT) Collection Site (Electronic collection arrays and processing shelters tasked with cueing anti-ship weapons and intercepting allied communications).",
      "justification": "Denies enemy targeting intelligence, reduces threat to maneuvering task groups and amphibious assault elements.",
      "targetId": "0003-30022"
    },
    {
      "rank": 4,
      "effect": "DENY",
      "description": "Naval surface combatants, replenishment ships, and forward logistic staging vessels (Surface Warfare Task Group — Escort Destroyer, multi-mission destroyer configured for sea control and ASW; last known operating area noted).",
      "justification": "Removing surface combatant threat reduces risk to amphibious and logistic movements during exercise phase.",
      "targetId": "0004-40031"
    },
    {
      "rank": 4,
      "effect": "DENY",
      "description": "Forward Replenishment Vessel (Large replenishment oiler/regimental support ship providing fuel and stores to forward units).",
      "justification": "Denies adversary long-range sustainment and ability to maintain forward group operations (strategic priority: deny sustainment).",
      "targetId": "0004-40032"
    },
    {
      "rank": 5,
      "effect": "PROTECT",
      "description": "Protect Allied Carrier Strike Group (CSG-AMBER) — enable layered air and missile defense for friendly high-value unit; preemptive suppression of nearby RCPF offensive capabilities.",
      "justification": "Commander’s highest priority to maintain sea control and power projection (strategic priority: protect joint forces).",
      "targetId": "0005-50051"
    },
    {
      "rank": 5,
      "effect": "PROTECT",
      "description": "Sustain Forward Logistics Node — Allied Beach Staging Area (BSA-FWD-SIM) — protected logistic node for distribution of fuel, munitions, and spares to amphibious and ground units.",
      "justification": "Sustainment ensures continued operations during all phases and supports stabilization post-engagement.",
      "targetId": "0005-50052"
    }
  ]
}